[
  {
    "nameBn": "আহসানউল্লাহ বিজ্ঞান ও প্রযুক্তি বিশ্ববিদ্যালয়",
    "nameEn": "Ahsanullah University of Science and Technology",
    "shortName": "AUST",
    "id": "aust",
    "category": ["প্রাইভেট"],
    "description": "দেশের অন্যতম সেরা একটি বেসরকারি প্রকৌশল বিশ্ববিদ্যালয়।",
    "link": "/private/aust",
    "logo": "https://upload.wikimedia.org/wikipedia/en/a/ac/Ahsanullah_University_of_Science_and_Technology_Logo.svg"
  }
]
